{"$schema":"https://json-schema.org/draft/2020-12/schema","$id":"knowledge/cinnamoroll-popup-cafe-faq-1308-fact-snapshot.schema.json","type":"object","additionalProperties":false,"required":["snapshot_format","snapshot_id","source_id","source_url","retrieved_at","capture_policy","facts","non_claims"],"properties":{"snapshot_format":{"const":"fact_limited_official_support_snapshot_v1"},"snapshot_id":{"const":"tgc_faq_1308_cinnamoroll_popup_cafe_2026_08_17"},"source_id":{"const":"source_tgc_faq_1308_cinnamoroll_popup_cafe"},"source_url":{"const":"https://thatgamecompany.helpshift.com/hc/en/17-sky-children-of-the-light/faq/1308-patch-notes---april-10-2024---0-25-0-257483-android-huawei-256148-ios-playstation-257607-pc-255731-switch/"},"retrieved_at":{"const":"2026-08-17"},"capture_policy":{"type":"string","minLength":1},"facts":{"type":"object","additionalProperties":false,"required":["historical_window_start_date","historical_window_end_date","paid_offers","event_currency_offers","return_plan_statement"],"properties":{"historical_window_start_date":{"const":"2024-04-27"},"historical_window_end_date":{"const":"2024-05-17"},"paid_offers":{"type":"array","minItems":4,"maxItems":4},"event_currency_offers":{"type":"array","minItems":2,"maxItems":2},"return_plan_statement":{"const":"items from this collaboration event are not currently planned to return"}}},"non_claims":{"type":"array","minItems":1,"items":{"type":"string","minLength":1}}}}
